{
  "program": "MINOR-ACTM",
  "intake_year": "2024-25",
  "school": "School of Science",
  "title": "Undergraduate Minor Program in Actuarial Mathematics",
  "source": {
    "file": "cache\\prog-crs\\raw\\2024-25\\MINOR-ACTM.txt",
    "parsed_at": ""
  },
  "notes": [],
  "remarks": [
    "MATH 4428:              The course was last offered in 2019-20 and was deleted subsequently."
  ],
  "requirements": [
    {
      "block": "major",
      "name": "Major Requirements",
      "sections": [
        {
          "type": "required",
          "name": "Required Course(s)",
          "groups": [
            {
              "subject": "",
              "note": "",
              "credits": "",
              "kind": "single",
              "courses": [
                {
                  "code": "MATH 2511",
                  "title": "Fundamentals of Actuarial Mathematics",
                  "credits": "3",
                  "area": ""
                }
              ],
              "areas": []
            }
          ]
        },
        {
          "type": "elective",
          "name": "Elective(s)",
          "groups": [
            {
              "subject": "MATH/RMBI",
              "note": "Actuarial/Mathematics Electives (5 courses from the specified elective list, of which 2 courses must be taken from the list of Foundation Electives and 3 courses from the list of Advanced Electives) List 1 - Foundation Electives (Students may request to replace MATH 2411 by IEDA 2540, ISOM 2500, or LIFS 3150; and MATH 2421 by ELEC 2600, IEDA 2520 or ISOM 3540.) List 2 - Advanced Electives Mathematics",
              "credits": "15",
              "kind": "pool",
              "courses": [
                {
                  "code": "MATH 2411",
                  "title": "Applied Statistics",
                  "credits": "4",
                  "area": ""
                },
                {
                  "code": "MATH 2421",
                  "title": "Probability",
                  "credits": "4",
                  "area": ""
                },
                {
                  "code": "MATH 2431",
                  "title": "Honors Probability",
                  "credits": "4",
                  "area": ""
                },
                {
                  "code": "MATH 3423",
                  "title": "Statistical Inference",
                  "credits": "3",
                  "area": ""
                },
                {
                  "code": "MATH 4426",
                  "title": "Survival Analysis",
                  "credits": "3",
                  "area": ""
                },
                {
                  "code": "MATH 4427",
                  "title": "Loss Models and their Applications",
                  "credits": "3",
                  "area": ""
                },
                {
                  "code": "MATH 4428",
                  "title": "Bayesian Analysis and Credibility Theory",
                  "credits": "3",
                  "area": ""
                },
                {
                  "code": "MATH 4429",
                  "title": "Credibility Theory and its Applications",
                  "credits": "3",
                  "area": ""
                },
                {
                  "code": "MATH 4511",
                  "title": "Quantitative Methods for Fixed Income Derivatives",
                  "credits": "3",
                  "area": ""
                },
                {
                  "code": "MATH 4512",
                  "title": "Fundamentals of Mathematical Finance",
                  "credits": "3",
                  "area": ""
                },
                {
                  "code": "MATH 4513",
                  "title": "Life Contingencies Models and Insurance Risk",
                  "credits": "3",
                  "area": ""
                },
                {
                  "code": "MATH 4514",
                  "title": "Financial Economics in Actuarial Science",
                  "credits": "3",
                  "area": ""
                },
                {
                  "code": "MATH 4515",
                  "title": "Statistical and Computational Methods in Financial",
                  "credits": "3",
                  "area": ""
                },
                {
                  "code": "MATH 4825",
                  "title": "Special Topics in Actuarial Mathematics",
                  "credits": "3",
                  "area": ""
                },
                {
                  "code": "RMBI 4220",
                  "title": "Life Contingencies Models and Insurance Risk",
                  "credits": "3",
                  "area": ""
                }
              ],
              "areas": []
            }
          ]
        }
      ],
      "notes": [
        "(For students admitted in 2024-25 under the 4-year degree) Undergraduate Minor Program in Actuarial Mathematics Except for those studying the Financial and Actuarial Mathematics Track of the BSc program in Mathematics, any undergraduate student with an overall CGA of 1.85 or above may enroll in the Actuarial Mathematics Minor Program. Students must declare their intention to enroll in the Minor Program no earlier than the first regular term of their second year of study but no later than the last day of the add/drop period in the first regular term of their final year of study. Students who wish to withdraw from the Minor Program should apply before the last day of the add/drop period in the first regular term of their final year of study. Minor Requirements To graduate with a minor in Actuarial Mathematics, students must have enrolled in the Minor Program, complete a minimum total of 18 credits and all of the minor requirements, as well as the requirements of the major program of study; and have attained an average grade point of at least 1.5 in courses taken within the minor program. For credit transfer, students can transfer a maximum total of 6 credits to the Minor Program. Courses accepted for credit transfer must normally be at a level equivalent to courses coded above 1600. Out of the total credits required by the minor program, at least 9 credits should be single-counted within the minor and are not used to fulfill any other requirements for graduation except the 120-credit degree requirement. Courses used to fulfill the requirements of the Minor Program in Mathematics cannot be reused to count towards this Minor Program. Students may use no more than 9 credits earned from courses offered in self-paced online delivery mode to satisfy the graduation requirements of a degree program. This 9-credit limit does not apply to credits obtained through the credit transfer procedures of the University.",
        "2026-27 MINOR-ACTM (4Y) (2024-25 intake)                                                                                            Page 1 2026-27 MINOR-ACTM (4Y) (2024-25 intake)                                                                           Page 2"
      ]
    }
  ]
}