{
  "program": "IS",
  "intake_year": "2023-24",
  "school": "School of Business and Management",
  "title": "BBA in Information Systems",
  "source": {
    "file": "cache\\prog-crs\\raw\\2023-24\\IS.txt",
    "parsed_at": ""
  },
  "notes": [],
  "remarks": [],
  "requirements": [
    {
      "block": "major",
      "name": "Major Requirements",
      "sections": [
        {
          "type": "required",
          "name": "Required Course(s)",
          "groups": [
            {
              "subject": "BBA",
              "note": "in Information Systems In addition to the requirements of their major programs, students are required to complete the University and School requirements for graduation. For details please refer to the respective sections on this website. Unless approved by the Dean or the Dean's designate, students are not allowed to reuse courses that are counted towards the School Requirements to also fulfill the Major or Option requirements. Students may use no more than 9 credits earned from courses offered in self-paced online delivery mode to satisfy the graduation requirements of a degree program. This 9-credit limit does not apply to credits obtained through the credit transfer procedures of the University. For students graduating with an additional major, they must take all the requirements specified for that major, within which they must complete at least 20 single-counted credits. These 20 credits cannot be used to fulfill any other requirements for graduation except for the 120-credit degree requirement. Under the new 30-credit Common Core Program which is applicable to students admitted to the University in 2022-23 and thereafter, courses that have been counted towards School and/or Major Requirements are not allowed to be reused for fulfilment of the University Common Core Requirements. Students should look up the details of the Common Core Program including the general and School-/program-specific distributional requirements posted on the Common Core website where the link to it is available on this website. Major Requirements",
              "credits": "",
              "kind": "pool",
              "courses": [],
              "areas": []
            }
          ]
        },
        {
          "type": "required",
          "name": "Required Course(s)",
          "groups": [
            {
              "subject": "",
              "note": "",
              "credits": "",
              "kind": "single",
              "courses": [
                {
                  "code": "ISOM 3210",
                  "title": "Information Systems Analysis and Design",
                  "credits": "3",
                  "area": ""
                }
              ],
              "areas": []
            },
            {
              "subject": "",
              "note": "",
              "credits": "",
              "kind": "single",
              "courses": [
                {
                  "code": "ISOM 3260",
                  "title": "Database Design and Administration",
                  "credits": "4",
                  "area": ""
                }
              ],
              "areas": []
            },
            {
              "subject": "ISOM",
              "note": "Note: ISOM 3320 OR ISOM 3400 (Students who have taken requirements.)",
              "credits": "3",
              "kind": "pool",
              "courses": [
                {
                  "code": "COMP 1022P",
                  "title": "must take ISOM 3400; students who have taken",
                  "credits": "",
                  "area": ""
                },
                {
                  "code": "COMP 1021",
                  "title": "must take ISOM 3320 to fulfill the IS program",
                  "credits": "",
                  "area": ""
                },
                {
                  "code": "ISOM 3320",
                  "title": "Business Applications Development in Java",
                  "credits": "3",
                  "area": ""
                },
                {
                  "code": "ISOM 3400",
                  "title": "Business Applications Development in Python",
                  "credits": "3",
                  "area": ""
                }
              ],
              "areas": []
            }
          ]
        },
        {
          "type": "elective",
          "name": "Elective(s)",
          "groups": [
            {
              "subject": "ISOM",
              "note": "IS Electives (At least 3 ISOM courses totaling 10 credits coded between 3000 and 3499; 4000 and 4499. For students who have taken the 6-credit course ISOM 4400 to fulfill the IS elective requirement, the minimum number of courses for this requirement may be reduced by one. Courses taken as Option Required Courses may not be counted towards this elective requirement.) Students may opt to graduate with or without an option. Students who take an option MUST complete all requirements specified in addition to the major requirements.",
              "credits": "10",
              "kind": "pool",
              "courses": [],
              "areas": []
            }
          ]
        }
      ],
      "notes": [
        "(For students admitted in 2023-24 under the 4-year degree)"
      ]
    },
    {
      "block": "option",
      "name": "Artificial Intelligence Option",
      "sections": [
        {
          "type": "required",
          "name": "Required Course(s)",
          "groups": [
            {
              "subject": "",
              "note": "",
              "credits": "",
              "kind": "single",
              "courses": [
                {
                  "code": "ISOM 4030",
                  "title": "Deep Learning for Business Applications",
                  "credits": "3",
                  "area": ""
                }
              ],
              "areas": []
            },
            {
              "subject": "",
              "note": "",
              "credits": "",
              "kind": "single",
              "courses": [
                {
                  "code": "ISOM 4110",
                  "title": "Large Language Models and AI Agents",
                  "credits": "3",
                  "area": ""
                }
              ],
              "areas": []
            }
          ]
        }
      ]
    },
    {
      "block": "option",
      "name": "Business Analytics Option",
      "sections": [
        {
          "type": "required",
          "name": "Required Course(s)",
          "groups": [
            {
              "subject": "",
              "note": "",
              "credits": "",
              "kind": "single",
              "courses": [
                {
                  "code": "ISOM 3360",
                  "title": "Data Mining for Business Analytics",
                  "credits": "3",
                  "area": ""
                }
              ],
              "areas": []
            },
            {
              "subject": "",
              "note": "",
              "credits": "",
              "kind": "single",
              "courses": [
                {
                  "code": "ISOM 3900",
                  "title": "Decision Analytics",
                  "credits": "3",
                  "area": ""
                }
              ],
              "areas": []
            }
          ]
        }
      ]
    },
    {
      "block": "option",
      "name": "Information Systems Auditing Option",
      "sections": [
        {
          "type": "required",
          "name": "Required Course(s)",
          "groups": [
            {
              "subject": "",
              "note": "",
              "credits": "",
              "kind": "single",
              "courses": [
                {
                  "code": "ISOM 4100",
                  "title": "Information Systems Auditing",
                  "credits": "3",
                  "area": ""
                }
              ],
              "areas": []
            },
            {
              "subject": "",
              "note": "",
              "credits": "",
              "kind": "single",
              "courses": [
                {
                  "code": "ISOM 4300",
                  "title": "Information Systems Control and Assurance",
                  "credits": "3",
                  "area": ""
                }
              ],
              "areas": []
            }
          ]
        }
      ]
    }
  ]
}