{
  "program": "MINOR-BIOT",
  "intake_year": "2025-26",
  "school": "School of Science",
  "title": "Undergraduate Minor Program in Biotechnology",
  "source": {
    "file": "cache\\prog-crs\\raw\\2025-26\\MINOR-BIOT.txt",
    "parsed_at": ""
  },
  "notes": [],
  "remarks": [],
  "requirements": [
    {
      "block": "major",
      "name": "Major Requirements",
      "sections": [
        {
          "type": "required",
          "name": "Required Course(s)",
          "groups": [
            {
              "subject": "",
              "note": "",
              "credits": "",
              "kind": "single",
              "courses": [
                {
                  "code": "LIFS 2040",
                  "title": "Cell Biology",
                  "credits": "3",
                  "area": ""
                }
              ],
              "areas": []
            },
            {
              "subject": "",
              "note": "",
              "credits": "",
              "kind": "single",
              "courses": [
                {
                  "code": "LIFS 2210",
                  "title": "Biochemistry I",
                  "credits": "3",
                  "area": ""
                }
              ],
              "areas": []
            },
            {
              "subject": "",
              "note": "",
              "credits": "",
              "kind": "single",
              "courses": [
                {
                  "code": "LIFS 4630",
                  "title": "Advanced Topics in Biotechnology",
                  "credits": "3",
                  "area": ""
                }
              ],
              "areas": []
            }
          ]
        },
        {
          "type": "elective",
          "name": "Elective(s)",
          "groups": [
            {
              "subject": "LIFS/BTEC",
              "note": "Biotechnology Elecives (3 courses from the specified elective list, of which at least 3 credits must be at 4000-level or above.)",
              "credits": "9",
              "kind": "pool",
              "courses": [
                {
                  "code": "LIFS 3060",
                  "title": "Microbiology",
                  "credits": "3",
                  "area": ""
                },
                {
                  "code": "LIFS 3110",
                  "title": "Biotechnological Application of Recombinant DNA Techniques",
                  "credits": "3",
                  "area": ""
                },
                {
                  "code": "LIFS 3580",
                  "title": "Bioinformatics",
                  "credits": "3",
                  "area": ""
                },
                {
                  "code": "LIFS 4150",
                  "title": "Plant Biotechnology",
                  "credits": "3",
                  "area": ""
                },
                {
                  "code": "LIFS 4380",
                  "title": "Pharmacology and Toxicology",
                  "credits": "3",
                  "area": ""
                },
                {
                  "code": "LIFS 4550",
                  "title": "Biochemistry of Nutrition",
                  "credits": "3",
                  "area": ""
                },
                {
                  "code": "LIFS 4760",
                  "title": "Biochemistry of Diseases",
                  "credits": "3",
                  "area": ""
                },
                {
                  "code": "BTEC 5210",
                  "title": "Principles and Application in Biotechnology",
                  "credits": "4",
                  "area": ""
                },
                {
                  "code": "BTEC 5340",
                  "title": "Biomarkers and Medical Devices",
                  "credits": "3",
                  "area": ""
                }
              ],
              "areas": []
            }
          ]
        }
      ],
      "notes": [
        "(For students admitted in 2025-26 under the 4-year degree) Undergraduate Minor Program in Biotechnology Except for those with major in Biochemistry and Cell Biology (BCB), Biological Science (BISC), Biotechnology (BIOT), and Biomedical and Health Sciences (BMH), any undergraduate students under the 4-year degree with an overall CGA of 2.15 or above may enroll in the Biotechnology Minor Program. Students must declare their intention to enroll in the Minor Program no earlier than the first regular term of their second year of study but no later than the last day of the add/drop period in the first regular term of their final year of study. Students who wish to withdraw from the Minor Program should apply before the last day of the add/drop period in the first regular term of their final year of study. Minor Requirements To graduate with a minor in Biotechnology, students must have enrolled in the Minor Program and complete a minimum total of 18 credits and all of its requirements, as well as the requirements of the major program of study; and have attained an average grade point of at least 1.85 in courses taken within the minor program. For credit transfer, students can transfer a maximum total of 6 credits to the Minor Program. Out of the total credits required by the minor program, at least 9 credits should be single-counted within the minor and are not used to fulfill any other requirements for graduation except the 120-credit degree requirement. Students may use no more than 9 credits earned from courses offered in self-paced online delivery mode to satisfy the graduation requirements of a degree program. This 9-credit limit does not apply to credits obtained through the credit transfer procedures of the University.",
        "2026-27 MINOR-BIOT (4Y) (2025-26 intake)                                                                                            Page 1"
      ]
    }
  ]
}