{
  "program": "MINOR-SUSEE",
  "intake_year": "2023-24",
  "school": "School of Engineering",
  "title": "Undergraduate Minor Program in Sustainable Energy Engineering",
  "source": {
    "file": "cache\\prog-crs\\raw\\2023-24\\MINOR-SUSEE.txt",
    "parsed_at": ""
  },
  "notes": [],
  "remarks": [
    "CIVL 1170:              The course was last offered in 2021-22 and was deleted subsequently.",
    "ELEC 3450:            The course was last offered in 2020-21 and was deleted subsequently.",
    "ENVR 3003:            The course was last offered in 2019-20 and was deleted subsequently."
  ],
  "requirements": [
    {
      "block": "major",
      "name": "Major Requirements",
      "sections": [
        {
          "type": "required",
          "name": "Required Course(s)",
          "groups": [
            {
              "subject": "ELEC/MECH",
              "note": "Note: ELEC 3450 OR MECH 1902 PHYS",
              "credits": "3",
              "kind": "pool",
              "courses": [
                {
                  "code": "ELEC 3450",
                  "title": "Introduction to Smart Electric Power Systems",
                  "credits": "3",
                  "area": ""
                },
                {
                  "code": "MECH 1902",
                  "title": "Energy Systems in a Sustainable World",
                  "credits": "3",
                  "area": ""
                },
                {
                  "code": "CENG 2210",
                  "title": "Chemical and Biological Engineering Thermodynamics",
                  "credits": "3",
                  "area": ""
                },
                {
                  "code": "MECH 2310",
                  "title": "Thermodynamics",
                  "credits": "3",
                  "area": ""
                },
                {
                  "code": "PHYS 4050",
                  "title": "Thermodynamics and Statistical Physics",
                  "credits": "3",
                  "area": ""
                }
              ],
              "areas": []
            },
            {
              "subject": "",
              "note": "",
              "credits": "",
              "kind": "single",
              "courses": [
                {
                  "code": "SUST 1000",
                  "title": "Sustainability Fundamentals",
                  "credits": "3",
                  "area": ""
                }
              ],
              "areas": []
            }
          ]
        },
        {
          "type": "elective",
          "name": "Elective(s)",
          "groups": [
            {
              "subject": "AIS",
              "note": "the specified elective list, out of which at least 6 credits must be at 3000-level or above. Course(s) taken as required course(s) of the program may not be counted towards this elective requirement.) Energy and Environmental Sustainability Energy Conversion Energy Efficiency Sustainable Energy Generation",
              "credits": "",
              "kind": "pool",
              "courses": [
                {
                  "code": "CIVL 1170",
                  "title": "Big History, Sustainability and Climate Change",
                  "credits": "3",
                  "area": ""
                },
                {
                  "code": "CIVL 1190",
                  "title": "Climate Change, Big History and Sustainability",
                  "credits": "3",
                  "area": ""
                },
                {
                  "code": "MECH 1902",
                  "title": "Energy Systems in a Sustainable World",
                  "credits": "3",
                  "area": ""
                },
                {
                  "code": "ENVR 3110",
                  "title": "Life Cycle Assessment for Sustainable Development",
                  "credits": "3",
                  "area": ""
                },
                {
                  "code": "ENVR 3220",
                  "title": "Energy Sources and Usage",
                  "credits": "3",
                  "area": ""
                },
                {
                  "code": "PHYS 1003",
                  "title": "Energy and Related Environmental Issues",
                  "credits": "3",
                  "area": ""
                },
                {
                  "code": "SUST 1000",
                  "title": "Sustainability Fundamentals",
                  "credits": "3",
                  "area": ""
                },
                {
                  "code": "ELEC 3450",
                  "title": "Introduction to Smart Electric Power Systems",
                  "credits": "3",
                  "area": ""
                },
                {
                  "code": "ELEC 4430",
                  "title": "Integrated Power Electronics",
                  "credits": "3",
                  "area": ""
                },
                {
                  "code": "CENG 4140",
                  "title": "Energy Resources, Conversions and Technologies",
                  "credits": "3",
                  "area": ""
                },
                {
                  "code": "MECH 3300",
                  "title": "Energy Conversion",
                  "credits": "3",
                  "area": ""
                },
                {
                  "code": "MECH 3630",
                  "title": "Electrical Technology",
                  "credits": "3",
                  "area": ""
                },
                {
                  "code": "MECH 1905",
                  "title": "Buildings for Contemporary Living",
                  "credits": "3",
                  "area": ""
                },
                {
                  "code": "ENVR 3003",
                  "title": "Green Buildings and Energy Efficiency",
                  "credits": "3",
                  "area": ""
                },
                {
                  "code": "ELEC 4530",
                  "title": "Fundamentals of Photovoltaic and Renewable Energy",
                  "credits": "3",
                  "area": ""
                },
                {
                  "code": "CHEM 4640",
                  "title": "Chemistry for Advanced Solar Cell Technologies",
                  "credits": "3",
                  "area": ""
                }
              ],
              "areas": []
            }
          ]
        }
      ],
      "notes": [
        "(For students admitted in 2023-24 under the 4-year degree) Undergraduate Minor Program in Sustainable Energy Engineering The Minor Program in Sustainable Energy Engineering is designed mainly for engineering students, but also open to students from other Schools with knowledge in foundation Calculus (e.g. MATH 1012, MATH 1013, MATH 1020, or MATH 1023. Students who have not taken one of these courses but obtained grade A- or above in MATH 1003 may also be considered). Any undergraduate students with an overall CGA of 2.5 or above may enroll in this Minor Program. Students must declare their intention to enroll in the Minor Program no earlier than the first regular term of their second year of study but no later than the last day of the add/drop period in the first regular term of their final year of study. Students who wish to withdraw from the Minor Program should apply before the last day of the add/drop period in the first regular term of their final year of study. Minor Requirements To graduate with a minor in Sustainable Energy Engineering, students must have enrolled in the Minor Program and complete a minimum total of 18 credits and all of its requirements, as well as the requirements of the major program of study. For credit transfer, students can transfer a maximum total of 6 credits to the Minor Program Out of the total credits required by the minor program, at least 9 credits should be single-counted within the minor and are not used to fulfill any other requirements for graduation except the 120-credit degree requirement. Students may use no more than 9 credits earned from courses offered in self-paced online delivery mode to satisfy the graduation requirements of a degree program. This 9-credit limit does not apply to credits obtained through the credit transfer procedures of the University. Some courses in the curriculum have been previously coded with CORE-prefix where the special CORE-prefix has been replaced by the domain code of courses starting from Fall 2023-24. Students who have registered with these CORE- coded courses may look up their latest course codes by consulting the conversion table published on the Common Core website.",
        "CENG/MECH/                 Note: CENG 2210 OR MECH 2310 OR PHYS 4050                                                    3 2026-27 MINOR-SUSEE (4Y) (2023-24 intake)                                                                                           Page 1",
        "SENG/SSCI/                  Sustainable Energy Engineering Electives (3 courses from                      9 2026-27 MINOR-SUSEE (4Y) (2023-24 intake)                                                                             Page 2"
      ]
    }
  ]
}